"6998571","garri.rogov","HCHYBDJZJOX","ЗАО ХозУралКазань","Id minus harum in occaecati dolor."
"44","vyceslav85","LSRLZG4L","ОАО Транс","Neque ex suscipit enim."
"1207856","daniil.kolesnikov","DNOHHPTE","ЗАО МетизЭлектроКазань","Fugiat totam dolores voluptatem."
"3105692","fomicev.albina","NBMJTWIB","ОАО МетизТверьАсбоцемент","Odit officia fugit quisquam eius omnis veritatis quo."
"5356527","lebedev.igor","LIGWCWL4","ОАО АвтоАлмазБашкирЭкспедиция","Error quae saepe ut et aut sequi et."
"603163","nestor59","SKZUCLBGDRJ","ООО МоторТранс","Qui voluptas rem optio blanditiis sit aut sunt."
"25866","igor23","AFDXIS385RC","ОАО Тяж","Sapiente quos quo repellendus facere accusamus eum dolor."
"367","fedor49","OJPEMOQH","ОАО БашкирТяжСантехМашина","Dolor distinctio dolor quibusdam dignissimos nisi."
"842033156","umamontov","CNMTYLTV","ООО Электро","Minus omnis id maxime aut et quia quod."
"6055020","hsavelev","IFEQQS6P","ООО Компания БашкирТекстиль","Veniam debitis libero totam et culpa et."
